{
  "schemaVersion": 1,
  "setVersion": "mind-eye-authored-frame-set/1",
  "compilerVersion": "mind-eye-authored-frame-compiler/1.0.3",
  "expectedManifestCount": 37,
  "manifestSetSHA256": "8ca078cdc925432ef11f963b2a0ba0056d6a0f25848eb30b81ce38a6f767cc4a",
  "registrySHA256": "81bdc9ce5e97b0ef02b9278bea8d84a8a280391a0b01a220f5be3a19577b0c9b",
  "toolchainLockSHA256": "c5c57d5328fe9de6aa14f2f3b522cdd226914efb3339bac9211a9d5002f42c68",
  "compilerConfigSHA256": "06b0cb83412565c3fae1a1b29c28c1c6015c13ab9dfe7359317196a68f70a5e9",
  "phonemePoseMapSHA256": "32aaf5b5b5369d684ada94c847a26db9e6ff80b4fee97b687f47a4d9fb98470c",
  "pronunciationOverridesSHA256": "37e51d87a72e82c6e30ccf95fdc612523c14c156e6344d2ae3b427fabab845fa",
  "entries": [
    {
      "prID": "chapter01.room.cateye81.hamReceiver.script05.001",
      "speakerCharacterID": "cateye81",
      "interactionSurface": "hamReceiver",
      "manifestResourcePath": "Turing/MindsEye/AudioFrames/chapter01.room.cateye81.hamReceiver.script05.001.mouthframes.json",
      "manifestSHA256": "442f7c6fa5ec872e8c2421cbf59aaa5a63554058ce812187d23007970e7c8614",
      "descriptorSHA256": "e78984d934bc6df2d018cb8962811fd5c2df93962702b5cdbc7f34ab3f5b9937",
      "audioSHA256": "aa6ad8c5043e4d98b65d9da9af41ee5833fd00ad286203051c6e75614c207de6",
      "transcriptSHA256": "7e3cce1d670853eb47c7f46e8123b7dbb02c9290ce73bf112a66c668550ad9ec",
      "sampleCount": 2877649,
      "frameCount": 3598,
      "durationSeconds": 59.951020833,
      "poseFrameCounts": {
        "rest": 890,
        "small": 911,
        "wide": 1160,
        "round": 217,
        "teeth": 420
      },
      "speechFrameCount": 2838,
      "fallbackFrameCount": 0,
      "manualOverrideFrameCount": 0,
      "warningCount": 2
    },
    {
      "prID": "chapter01.room.rich.dadFrame.fourChances.001",
      "speakerCharacterID": "rich",
      "interactionSurface": "dadFrame",
      "manifestResourcePath": "Turing/MindsEye/AudioFrames/chapter01.room.rich.dadFrame.fourChances.001.mouthframes.json",
      "manifestSHA256": "419d9f7a455d717ffecf4bbbd0c944266a83dccbcc47f433fd7a7b739d5bc4f7",
      "descriptorSHA256": "f1aed9cf1f639753f216f096d35c47694bcb06d46e7432505ce6d549369e1f66",
      "audioSHA256": "e1bdd1c893a6f3adb30bdc2182c59ab2854b8c319d463ca4ef4c15de9f1b7db1",
      "transcriptSHA256": "37cae73a98978295c2538efd64e3f7ac37730162093127c675773fe87220ce12",
      "sampleCount": 1925956,
      "frameCount": 2408,
      "durationSeconds": 40.124083333,
      "poseFrameCounts": {
        "rest": 524,
        "small": 643,
        "wide": 639,
        "round": 241,
        "teeth": 361
      },
      "speechFrameCount": 1954,
      "fallbackFrameCount": 92,
      "manualOverrideFrameCount": 0,
      "warningCount": 2
    },
    {
      "prID": "chapter01.room.rich.dadFrame.script03.001",
      "speakerCharacterID": "rich",
      "interactionSurface": "dadFrame",
      "manifestResourcePath": "Turing/MindsEye/AudioFrames/chapter01.room.rich.dadFrame.script03.001.mouthframes.json",
      "manifestSHA256": "311cbc2b5414ba9ead4ced902f9d01edf14865025b3541d634203e1807b0e855",
      "descriptorSHA256": "d6e15beaea4d07fe8dcbe1923c8d1f4f7fd801dc9fd656537b626c903bf46c0b",
      "audioSHA256": "ac7d3fc20b3885495f551278c54e519917d044d84b8a3312a57e069644f3db4d",
      "transcriptSHA256": "11f5480bbfa40aba69723aa7058120f2e2080f6b631f87e5616685c5a7608740",
      "sampleCount": 2310897,
      "frameCount": 2889,
      "durationSeconds": 48.1436875,
      "poseFrameCounts": {
        "rest": 842,
        "small": 750,
        "wide": 629,
        "round": 315,
        "teeth": 353
      },
      "speechFrameCount": 2124,
      "fallbackFrameCount": 89,
      "manualOverrideFrameCount": 0,
      "warningCount": 2
    },
    {
      "prID": "chapter01.room.rich.hamReceiver.script04.001",
      "speakerCharacterID": "rich",
      "interactionSurface": "hamReceiver",
      "manifestResourcePath": "Turing/MindsEye/AudioFrames/chapter01.room.rich.hamReceiver.script04.001.mouthframes.json",
      "manifestSHA256": "a5e2d48c60a49c8894862cee3b9ce646fcdc4445f364357806f9e4123d51d0e5",
      "descriptorSHA256": "33a0fa6d16720a824a70dd3e624fb3318dc77e07a8259c83b9f8640130309b65",
      "audioSHA256": "849849e768a83b85b52a20306552f089661775ede55f4fd0f8bab60e349a0af0",
      "transcriptSHA256": "4589dff110fbe008725dc9c4e8b76bc56cb7cf44c7cc47b27108177c636df6b4",
      "sampleCount": 2204317,
      "frameCount": 2756,
      "durationSeconds": 45.923270833,
      "poseFrameCounts": {
        "rest": 560,
        "small": 784,
        "wide": 790,
        "round": 200,
        "teeth": 422
      },
      "speechFrameCount": 2288,
      "fallbackFrameCount": 0,
      "manualOverrideFrameCount": 0,
      "warningCount": 3
    },
    {
      "prID": "chapter01.walkie.bigMike.script07.001",
      "speakerCharacterID": "big_mike",
      "interactionSurface": "walkie",
      "manifestResourcePath": "Turing/MindsEye/AudioFrames/chapter01.walkie.bigMike.script07.001.mouthframes.json",
      "manifestSHA256": "31f051bbea33be61fc8b59cb0c41c79d70e50c66f90b71ebaf1811c7d291e56a",
      "descriptorSHA256": "81b1da6225705f5d806ec1778aef0220b045565ffc5f4333e73ebe73d8b426c1",
      "audioSHA256": "cb266e1736c18fa7e1d315d72d39756af20d291013a699eb84ea5027f5f9430e",
      "transcriptSHA256": "22f8dad8352e83623ba7e5dffa4313871ecf4df1f9cbc9b5c1e4ab80bf0e62b8",
      "sampleCount": 2278296,
      "frameCount": 2848,
      "durationSeconds": 47.4645,
      "poseFrameCounts": {
        "rest": 701,
        "small": 666,
        "wide": 747,
        "round": 264,
        "teeth": 470
      },
      "speechFrameCount": 2251,
      "fallbackFrameCount": 0,
      "manualOverrideFrameCount": 0,
      "warningCount": 4
    },
    {
      "prID": "chapter01.walkie.bigMike.script09.001",
      "speakerCharacterID": "big_mike",
      "interactionSurface": "walkie",
      "manifestResourcePath": "Turing/MindsEye/AudioFrames/chapter01.walkie.bigMike.script09.001.mouthframes.json",
      "manifestSHA256": "bde47c1b3b6cd64fac3f3775dc5ae386686287860a7813e0f96e4fa238d2cb02",
      "descriptorSHA256": "7eaa52de3ea46b63a306e5ff4199e913caa2b8375b9f3fe0d60ee51f52e10180",
      "audioSHA256": "0284433e0aedd34d06ade0f14bc4a094086b659fe2b15c28aa0389d7512393df",
      "transcriptSHA256": "cea1545addc601f3d2bc1104466b52f6ca84b5d3d907f45005e10e7f344be895",
      "sampleCount": 2097738,
      "frameCount": 2623,
      "durationSeconds": 43.702875,
      "poseFrameCounts": {
        "rest": 697,
        "small": 652,
        "wide": 635,
        "round": 299,
        "teeth": 340
      },
      "speechFrameCount": 1974,
      "fallbackFrameCount": 199,
      "manualOverrideFrameCount": 0,
      "warningCount": 2
    },
    {
      "prID": "chapter01.walkie.rich.script06.001",
      "speakerCharacterID": "rich",
      "interactionSurface": "walkie",
      "manifestResourcePath": "Turing/MindsEye/AudioFrames/chapter01.walkie.rich.script06.001.mouthframes.json",
      "manifestSHA256": "fc1d3c5b5f9f00f7e1bdb6954b044a81584fe8b37484418528670e5372983a5d",
      "descriptorSHA256": "d6a3d71db7140dc688bbb1bbb955c1344434030b379e0d6446a323f04f5620c7",
      "audioSHA256": "64621c28ffc1ccb289e2f7dfc9df44c7fe67a020e471abb5273b56dbb2d15a7a",
      "transcriptSHA256": "3a331f3a03bcf29f2e159eeb12828b1e513b4418f23ff7fd5e482f9e0be4e72b",
      "sampleCount": 2267011,
      "frameCount": 2834,
      "durationSeconds": 47.229395833,
      "poseFrameCounts": {
        "rest": 594,
        "small": 761,
        "wide": 850,
        "round": 234,
        "teeth": 395
      },
      "speechFrameCount": 2375,
      "fallbackFrameCount": 0,
      "manualOverrideFrameCount": 0,
      "warningCount": 7
    },
    {
      "prID": "chapter01.walkie.rich.script08.001",
      "speakerCharacterID": "rich",
      "interactionSurface": "walkie",
      "manifestResourcePath": "Turing/MindsEye/AudioFrames/chapter01.walkie.rich.script08.001.mouthframes.json",
      "manifestSHA256": "f8d19647c785068e883fcf56ea52fefc3168e38914282d0103ab97cea2d8d2a1",
      "descriptorSHA256": "db7b23fac173bbf7e81887a66fa1622bcbf0e16dce3b60c70cefd333f4ed7300",
      "audioSHA256": "381f2bae35f02a449cc418756eb39faa748df9752d686b7402bb15e201cbd41d",
      "transcriptSHA256": "c516a685c23a2059c8f1d171baaff19c23d38f58d5e1fd02b8c7877917b12259",
      "sampleCount": 1869532,
      "frameCount": 2337,
      "durationSeconds": 38.948583333,
      "poseFrameCounts": {
        "rest": 568,
        "small": 689,
        "wide": 575,
        "round": 160,
        "teeth": 345
      },
      "speechFrameCount": 1871,
      "fallbackFrameCount": 94,
      "manualOverrideFrameCount": 0,
      "warningCount": 4
    },
    {
      "prID": "chapter02.crankRadio.broadcaster.gravitasPSA.003",
      "speakerCharacterID": "broadcaster",
      "interactionSurface": "crankRadio",
      "manifestResourcePath": "Turing/MindsEye/AudioFrames/chapter02.crankRadio.broadcaster.gravitasPSA.003.mouthframes.json",
      "manifestSHA256": "14256073e1870f98378867060eba31ed08b3c2ac16615579e9d0ae957cadcba0",
      "descriptorSHA256": "64348da2c288e829d8a639e0fee7cafd63e051188fba48e705c36ee563b0695d",
      "audioSHA256": "550ab0f608e5c34a4b660cd4687640c1b6bc28aeb7c3bbaec3d41703d3a7e9b2",
      "transcriptSHA256": "e2042243cc9fd61949f725a04bfed0f11f91ab3f3d65fadd5f20dde42dc4c9dd",
      "sampleCount": 2700853,
      "frameCount": 3377,
      "durationSeconds": 56.267770833,
      "poseFrameCounts": {
        "rest": 999,
        "small": 881,
        "wide": 906,
        "round": 226,
        "teeth": 365
      },
      "speechFrameCount": 2578,
      "fallbackFrameCount": 0,
      "manualOverrideFrameCount": 0,
      "warningCount": 5
    },
    {
      "prID": "chapter02.crankRadio.broadcaster.gridFailure.002",
      "speakerCharacterID": "broadcaster",
      "interactionSurface": "crankRadio",